{
  "meta": {
    "schema_version": 1,
    "data_date": "2026-07-18",
    "generated_at": "2026-07-18T08:30:00+08:00",
    "sources": ["FinMind", "yfinance"]
  },
  "profile": { "id": "2330", "name": "台積電", "market": "TWSE", "is_core_holding": true },
  "price": { "close": 2440, "change_pct": -0.4, "ma20": 2429.5, "ma60": 2350.0 },

  "primary_decision": {
    "action": "續抱",
    "stance": "中性偏多",
    "position_delta": "hold",
    "confidence": 62,
    "decided_by_layer": 4,
    "reason_codes": ["trend_ok", "valuation_expensive", "chips_weak"],
    "readable_reason": "因為趨勢仍在且基本面未壞，所以不急著賣；但估值已偏貴，未突破前不加碼。",
    "risk_note": "跌破 2,245 防守位就先降波段部位。",
    "position": { "tier_amount": 200000, "lots": 0, "odd_shares": 82 },
    "defense_price": 2245,
    "entry_condition": null,
    "reeval_date": "2026-07-25",
    "core_note": "此為波段層判斷，不影響定期定額核心部位。"
  },

  "context": {
    "timeframes": {
      "short": { "label": "短線 1-4 週", "stance": "中性", "basis": "技術偏多＋籌碼偏空" },
      "swing": { "label": "波段 1-3 月（主）", "stance": "中性偏多", "basis": "站上季線且法說會展望正向，但外資賣壓未歇" },
      "mid":   { "label": "中期 3-12 月", "stance": "中性", "basis": "AI 資本支出趨勢未變，估值已反映樂觀預期" }
    },
    "lights": {
      "fundamental": { "color": "yellow", "facts": ["營收 YoY +67.9%", "PER 32.8 落在近3年 82% 分位"] },
      "technical":   { "color": "green",  "facts": ["站上 MA20/60，多頭排列"] },
      "chips":       { "color": "red",    "facts": ["外資連 3 日賣超 1.6 萬張"] }
    },
    "valuation": {
      "band": "偏貴",
      "base": 2150, "bull": 2600, "bear": 1900,
      "regime": "3y",
      "warning": null
    },
    "rr": 1.8
  },

  "evidence": {
    "roles": [
      {
        "role": "技術面分析師",
        "support": ["站上 MA20/60，多頭排列未破壞", "近5日量能溫和放大"],
        "oppose": ["短線 KD 高檔鈍化，追高風險升高"],
        "verify": ["觀察是否守住 MA20（2,430 附近）"]
      },
      {
        "role": "基本面分析師",
        "support": ["營收 YoY +67.9%，AI 需求持續強勁"],
        "oppose": ["PER 32.8 落在近 3 年 82% 分位，估值不便宜"],
        "verify": ["下季法說會展望是否維持樂觀"]
      },
      {
        "role": "籌碼面分析師",
        "support": ["投信近期轉buy"],
        "oppose": ["外資連 3 日賣超 1.6 萬張"],
        "verify": ["外資賣壓是否持續超過 5 個交易日"]
      },
      {
        "role": "風控主管",
        "support": ["目前部位在容許級距內"],
        "oppose": ["若跌破 2,245 防守位，波段部位須先降"],
        "verify": ["每日收盤價與防守位的距離"]
      },
      {
        "role": "總經策略師",
        "support": ["美股 AI 資本支出趨勢未變"],
        "oppose": ["VIX 走升反映市場避險情緒升溫"],
        "verify": ["美股半導體類股是否止穩"]
      },
      {
        "role": "產業研究員",
        "support": ["先進製程訂單能見度佳"],
        "oppose": ["同業競爭與地緣政治風險仍在"],
        "verify": ["下季資本支出指引"]
      }
    ],
    "news": [
      { "title": "台積電法說會上修全年展望", "source": "經濟日報", "url": "https://example.com/news/2330-guidance", "published_at": "2026-07-16T09:00:00+08:00" },
      { "title": "外資連三日賣超台積電", "source": "工商時報", "url": "https://example.com/news/2330-foreign-sell", "published_at": "2026-07-17T15:30:00+08:00" }
    ],
    "events": [
      { "date": "2026-07-16", "label": "法說會", "impact_note": "上修全年營收展望，市場反應正向但股價已提前反映" }
    ]
  },

  "track": [
    { "date": "2026-07-15", "action": "減碼", "price_at_rec": 2453,
      "outcome": { "r5": null, "r20": null, "r60": null }, "status": "pending" },
    { "date": "2026-07-10", "action": "續抱", "price_at_rec": 2465,
      "outcome": { "r5": null, "r20": null, "r60": null }, "status": "pending" },
    { "date": "2026-07-03", "action": "試單", "price_at_rec": 2410,
      "outcome": { "r5": null, "r20": null, "r60": null }, "status": "pending" },
    { "date": "2026-06-25", "action": "觀望", "price_at_rec": 2388,
      "outcome": { "r5": null, "r20": null, "r60": null }, "status": "pending" }
  ]
}
